{
  "authorization_id": "AUTH-2025-001",
  "version": "1.0.0",
  "effective_date": "2025-11-12T00:00:00Z",
  "expiration_date": "2025-12-12T23:59:59Z",
  "scope_hash": "bc17b1eba4da77e7193efaa551c71374e9cf29b8564a732526e5433cd9a44b32",
  "authorized_by": {
    "name": "Jane Smith",
    "title": "Chief Information Security Officer",
    "email": "jane.smith@example.com",
    "phone": "+1-555-0100"
  },
  "in_scope": {
    "ip_addresses": [
      "192.168.1.100",
      "192.168.1.0/24",
      "10.0.0.0/16"
    ],
    "ip_ranges": [
      {
        "start": "10.0.0.100",
        "end": "10.0.0.200",
        "description": "Staging environment servers"
      }
    ],
    "hostnames": [
      "test.example.com",
      "api-staging.example.com",
      "app-staging.example.com"
    ],
    "wildcard_domains": [
      "*.staging.example.com",
      "*.test.example.com"
    ],
    "urls": [
      {
        "url": "https://api-staging.example.com/v1/*",
        "methods": ["GET", "POST", "PUT", "DELETE"],
        "description": "Staging API v1"
      },
      {
        "url": "https://api-staging.example.com/v2/*",
        "methods": ["GET"],
        "description": "Staging API v2 (read-only)"
      }
    ],
    "repositories": [
      {
        "url": "github.com/example-org/webapp",
        "branch": "staging",
        "commit_range": "abc123..def456"
      },
      {
        "url": "github.com/example-org/api",
        "branch": "develop"
      }
    ],
    "containers": [
      {
        "image": "webapp",
        "registry": "registry.example.com",
        "tag": "staging"
      },
      {
        "image": "api",
        "registry": "registry.example.com",
        "tag": "v2.1.0"
      }
    ],
    "cloud_resources": [
      {
        "provider": "aws",
        "resource_id": "123456789012",
        "region": "us-east-1",
        "resource_tags": {
          "environment": "staging",
          "pentest": "authorized"
        },
        "resource_types": ["EC2", "RDS", "S3"]
      }
    ],
    "api_endpoints": [
      {
        "base_url": "https://api-staging.example.com",
        "version": "v1",
        "authentication": "jwt",
        "rate_limit": 1000
      }
    ]
  },
  "out_of_scope": {
    "ip_addresses": [
      "192.168.2.0/24",
      "203.0.113.0/24"
    ],
    "ip_ranges": [
      {
        "start": "10.1.0.0",
        "end": "10.1.255.255",
        "reason": "Corporate network - production systems"
      }
    ],
    "hostnames": [
      "www.example.com",
      "api.example.com",
      "mail.example.com"
    ],
    "wildcard_domains": [
      "*.prod.example.com"
    ],
    "third_party_services": [
      {
        "service_name": "Cloudflare CDN",
        "reason": "Third-party service - do not test"
      },
      {
        "service_name": "Stripe payment gateway",
        "reason": "Third-party PCI-DSS compliant service"
      }
    ]
  },
  "time_windows": {
    "timezone": "America/New_York",
    "low_impact": {
      "days": ["monday", "tuesday", "wednesday", "thursday", "friday"],
      "start_time": "09:00",
      "end_time": "17:00"
    },
    "high_impact": {
      "days": ["saturday", "sunday"],
      "start_time": "23:00",
      "end_time": "05:00",
      "approval_required": true
    },
    "blackout_periods": [
      {
        "start": "2025-12-24T00:00:00Z",
        "end": "2025-12-26T23:59:59Z",
        "reason": "Holiday season"
      },
      {
        "start": "2025-12-31T00:00:00Z",
        "end": "2026-01-02T23:59:59Z",
        "reason": "New Year holiday"
      }
    ]
  },
  "allowed_methods": {
    "passive_reconnaissance": true,
    "network_scanning": {
      "enabled": true,
      "max_intensity": "medium",
      "allowed_ports": [22, 80, 443, 3306, 5432, 8080, 8443]
    },
    "vulnerability_scanning": {
      "enabled": true,
      "credentialed": true,
      "safe_checks_only": false
    },
    "web_application_testing": {
      "enabled": true,
      "injection_testing": true,
      "authentication_bypass": true,
      "authorization_testing": true
    },
    "active_exploitation": {
      "enabled": true,
      "requires_approval": true,
      "isolated_environment_only": true
    },
    "social_engineering": {
      "enabled": false,
      "phishing": false,
      "pretexting": false,
      "physical": false,
      "requires_hr_approval": true
    },
    "dos_testing": {
      "enabled": false,
      "isolated_environment_only": true
    }
  },
  "technical_constraints": {
    "rate_limits": {
      "http_requests_per_minute": 1000,
      "network_packets_per_second": 100
    },
    "resource_thresholds": {
      "cpu_percent": 80,
      "memory_percent": 90,
      "disk_io_percent": 80
    },
    "data_limits": {
      "max_data_extraction_mb": 100,
      "max_personal_records": 0
    }
  },
  "emergency_contacts": [
    {
      "name": "Jane Smith",
      "phone": "+1-555-0100",
      "email": "jane.smith@example.com",
      "role": "CISO",
      "priority": "primary"
    },
    {
      "name": "John Doe",
      "phone": "+1-555-0200",
      "email": "john.doe@example.com",
      "role": "Security Engineer",
      "priority": "secondary"
    }
  ],
  "metadata": {
    "created_by": "Security Team",
    "created_at": "2025-11-12T10:00:00Z",
    "last_modified_by": "Security Team",
    "last_modified_at": "2025-11-12T10:00:00Z",
    "notes": "Initial pentest scope for staging environment security assessment"
  }
}
